{"$schema":"https://json-schema.org/draft/2020-12/schema","$id":"scaling_decision.schema.json","x-schema-version":"2.0","type":"object","required":["$schema","schema_version","decision","predicted_gain","risk_delta","next_repo_batch","updated_policy","confidence","what_would_change_my_mind","memo"],"properties":{"$schema":{"type":"string"},"schema_version":{"type":"string"},"decision":{"type":"string","enum":["GO","HOLD","NO_GO"]},"predicted_gain":{"type":"object","required":["value","confidence","evidence_uris","rubric_version"]},"risk_delta":{"type":"object","required":["value","confidence","evidence_uris","rubric_version"]},"next_repo_batch":{"type":"array","items":{"type":"string"}},"updated_policy":{"type":"string"},"confidence":{"type":"object","required":["value","confidence","evidence_uris","rubric_version"]},"what_would_change_my_mind":{"type":"array","minItems":1,"items":{"type":"string"}},"memo":{"type":"array","minItems":1,"items":{"type":"object","required":["claim","metric_uri"],"properties":{"claim":{"type":"string"},"metric_uri":{"type":"string"}},"additionalProperties":false}}},"additionalProperties":false}
